{
  "id": "line-call-1",
  "call_id": "line-call-1",
  "agent_id": "support-line",
  "started_at": "2026-08-22T12:00:00Z",
  "ended_at": "2026-08-22T12:01:00Z",
  "turns": [
    {
      "speaker": "user",
      "text": "What's the weather?",
      "started_at": "2026-08-22T12:00:01Z",
      "ended_at": "2026-08-22T12:00:03Z",
      "stt_ttfb_ms": 90,
      "tts_ttfb_ms": 110
    },
    {
      "speaker": "agent",
      "text": "It's sunny in Oakland.",
      "started_at": "2026-08-22T12:00:03.200Z",
      "ended_at": "2026-08-22T12:00:06Z",
      "tts_ttfb_ms": 80
    }
  ]
}
